<?xml version="1.0" encoding="UTF-8"?>
<!DOCTYPE dwr PUBLIC
    "-//GetAhead Limited//DTD Direct Web Remoting 2.0//EN"
    "http://getahead.org/dwr/dwr20.dtd">

<dwr>

  <init>
    <creator id="jsf" class="org.openmrs.contrib.dwr.faces.JsfCreator"/>
    <creator id="none" class="org.openmrs.contrib.dwr.create.NullCreator"/>
    <creator id="new" class="org.openmrs.contrib.dwr.create.NewCreator"/>
    <creator id="pageflow" class="org.openmrs.contrib.dwr.beehive.PageFlowCreator"/>
    <creator id="spring" class="org.openmrs.contrib.dwr.spring.SpringCreator"/>
    <creator id="script" class="org.openmrs.contrib.dwr.create.ScriptedCreator"/>
    <creator id="ejb3" class="org.openmrs.contrib.dwr.create.Ejb3Creator"/>

    <converter id="null" class="org.openmrs.contrib.dwr.convert.NullConverter"/>
    <converter id="enum" class="org.openmrs.contrib.dwr.convert.EnumConverter"/>
    <converter id="primitive" class="org.openmrs.contrib.dwr.convert.PrimitiveConverter"/>
    <converter id="bignumber" class="org.openmrs.contrib.dwr.convert.BigNumberConverter"/>
    <converter id="string" class="org.openmrs.contrib.dwr.convert.StringConverter"/>
    <converter id="array" class="org.openmrs.contrib.dwr.convert.ArrayConverter"/>
    <converter id="map" class="org.openmrs.contrib.dwr.convert.MapConverter"/>
    <converter id="collection" class="org.openmrs.contrib.dwr.convert.CollectionConverter"/>
    <converter id="date" class="org.openmrs.contrib.dwr.convert.DateConverter"/>
    <converter id="dom" class="org.openmrs.contrib.dwr.convert.DOMConverter"/>
    <converter id="dom4j" class="org.openmrs.contrib.dwr.convert.DOM4JConverter"/>
    <converter id="jdom" class="org.openmrs.contrib.dwr.convert.JDOMConverter"/>
    <converter id="xom" class="org.openmrs.contrib.dwr.convert.XOMConverter"/>
    <converter id="servlet" class="org.openmrs.contrib.dwr.convert.ServletConverter"/>
    <converter id="bean" class="org.openmrs.contrib.dwr.convert.BeanConverter"/>
    <converter id="object" class="org.openmrs.contrib.dwr.convert.ObjectConverter"/>
    <converter id="hibernate2" class="org.openmrs.contrib.dwr.hibernate.H2BeanConverter"/>
    <converter id="hibernate3" class="org.openmrs.contrib.dwr.hibernate.H3BeanConverter"/>
    <converter id="url" class="org.openmrs.contrib.dwr.convert.URLConverter"/>
    <converter id="exception" class="org.openmrs.contrib.dwr.convert.ExceptionConverter"/>
    <converter id="miniException" class="org.openmrs.contrib.dwr.convert.MinimalistExceptionConverter"/>
  </init>

  <allow>
    <convert converter="null" match="void"/>
    <convert converter="null" match="java.lang.Void"/>

    <convert converter="miniException" match="java.lang.Throwable"/>

    <convert converter="primitive" match="boolean"/>
    <convert converter="primitive" match="byte"/>
    <convert converter="primitive" match="short"/>
    <convert converter="primitive" match="int"/>
    <convert converter="primitive" match="long"/>
    <convert converter="primitive" match="float"/>
    <convert converter="primitive" match="double"/>
    <convert converter="primitive" match="char"/>
    <convert converter="primitive" match="java.lang.Boolean"/>
    <convert converter="primitive" match="java.lang.Byte"/>
    <convert converter="primitive" match="java.lang.Short"/>
    <convert converter="primitive" match="java.lang.Integer"/>
    <convert converter="primitive" match="java.lang.Long"/>
    <convert converter="primitive" match="java.lang.Float"/>
    <convert converter="primitive" match="java.lang.Double"/>
    <convert converter="primitive" match="java.lang.Character"/>

    <convert converter="bignumber" match="java.math.BigInteger"/>
    <convert converter="bignumber" match="java.math.BigDecimal"/>

    <convert converter="string" match="java.lang.String"/>
    <convert converter="date" match="java.util.Date"/>
    <convert converter="date" match="java.sql.Date"/>
    <convert converter="date" match="java.sql.Time"/>
    <convert converter="date" match="java.sql.Timestamp"/>
    <convert converter="date" match="java.util.Calendar"/>
    <convert converter="url" match="java.net.URL"/>

    <convert converter="array" match="[Z"/>
    <convert converter="array" match="[B"/>
    <convert converter="array" match="[S"/>
    <convert converter="array" match="[I"/>
    <convert converter="array" match="[J"/>
    <convert converter="array" match="[F"/>
    <convert converter="array" match="[D"/>
    <convert converter="array" match="[C"/>
    <convert converter="array" match="[L*"/>

    <!--
    The catch for the next 2 is that we really mean java.util.Collection<String>
    and java.util.Map<String, String> but we need to do more work before this
    syntax is enabled
    -->
    <convert converter="collection" match="java.util.Collection"/>
    <convert converter="map" match="java.util.Map"/>

    <convert converter="dom" match="org.w3c.dom.Node"/>
    <convert converter="dom" match="org.w3c.dom.Element"/>
    <convert converter="dom" match="org.w3c.dom.Document"/>
    <convert converter="dom4j" match="org.dom4j.Document"/>
    <convert converter="dom4j" match="org.dom4j.Element"/>
    <convert converter="dom4j" match="org.dom4j.Node"/>
    <convert converter="jdom" match="org.jdom.Document"/>
    <convert converter="jdom" match="org.jdom.Element"/>
    <convert converter="xom" match="nu.xom.Document"/>
    <convert converter="xom" match="nu.xom.Element"/>
    <convert converter="xom" match="nu.xom.Node"/>

    <convert converter="servlet" match="jakarta.servlet.ServletConfig"/>
    <convert converter="servlet" match="jakarta.servlet.ServletContext"/>
    <convert converter="servlet" match="jakarta.servlet.http.HttpServletRequest"/>
    <convert converter="servlet" match="jakarta.servlet.http.HttpServletResponse"/>
    <convert converter="servlet" match="jakarta.servlet.http.HttpSession"/>

  </allow>

</dwr>
